{
  "schema_version": "1.0.0",
  "delegation_id": "DEL-DEMO-API",
  "parent_task_id": "TASK-DEMO-001",
  "delegate": "backend-worker",
  "role": "backend-engineer",
  "why_delegate": "Implementation is bounded behind an approved contract.",
  "objective": "Implement the endpoint and focused tests.",
  "task_specific_context": ["domains/backend/api-contract.md", "docs/api.md"],
  "read_set": ["src/", "tests/", "docs/api.md"],
  "write_set": ["src/api/", "tests/api/"],
  "required_skills": ["architecture-first", "verify-before-completion"],
  "tools_allowed": ["filesystem.read", "filesystem.write", "shell.read", "shell.write"],
  "tools_denied": ["external.write"],
  "forbidden_actions": ["Deploy", "Migrate data", "Write outside write_set"],
  "max_effect_class": "E1",
  "workspace_isolation": "exclusive-path",
  "base_revision": null,
  "budget": {"max_turns": 8, "max_minutes": 30, "max_tokens": null},
  "acceptance_criteria": ["AC-1", "AC-2"],
  "expected_artifacts": ["source patch", "focused test result"],
  "stop_conditions": ["Contract is inconsistent", "Focused test cannot run"],
  "escalation_conditions": ["A migration is required", "Write scope must expand"],
  "return_contract": "artifact+handoff/v1"
}
